<?xml version="1.0" encoding="UTF-8"?>
<!--
/**
 * Magento
 *
 * NOTICE OF LICENSE
 *
 * This source file is subject to the Academic Free License (AFL 3.0)
 * that is bundled with this package in the file LICENSE_AFL.txt.
 * It is also available through the world-wide-web at this URL:
 * http://opensource.org/licenses/afl-3.0.php
 * If you did not receive a copy of the license and are unable to
 * obtain it through the world-wide-web, please send an email
 * to license@magentocommerce.com so we can send you a copy immediately.
 *
 * DISCLAIMER
 *
 * Do not edit or add to this file if you wish to upgrade Magento to newer
 * versions in the future. If you wish to customize Magento for your
 * needs please refer to http://www.magentocommerce.com for more information.
 *
 * @copyright   Copyright (c) 2014 X.commerce, Inc. (http://www.magentocommerce.com)
 * @license     http://opensource.org/licenses/afl-3.0.php  Academic Free License (AFL 3.0)
 */
-->
<validation xmlns:xsi="http://www.w3.org/2001/XMLSchema-instance" xsi:noNamespaceSchemaLocation="../../../../../../../../../../../lib/internal/Magento/Framework/Validator/etc/validation.xsd">
    <entity name="test_entity_a">
        <rules>
            <rule name="check_alnum_and_int_not_empty_and_have_valid_value">
                <property_constraints>
                    <property name="int">
                        <constraint class="Magento\Framework\Validator\Test\NotEmpty"/>
                    </property>
                </property_constraints>
            </rule>
            <rule name="check_alnum_has_valid_value">
                <property_constraints>
                    <property name="alnum">
                        <constraint class="Magento\Framework\Validator\Test\Alnum"/>
                    </property>
                </property_constraints>
            </rule>
        </rules>
        <groups>
            <group name="check_alnum">
                <uses>
                    <use rule="check_alnum_has_valid_value"/>
                </uses>
            </group>
        </groups>
    </entity>
</validation>
